,Unnamed: 0,Unnamed: 0.1,Created_At,Tweets
298,298,298,2021-10-21 13:31:51+00:00,b'yuk 2k/voc. buat shoppe ga harus ada spay kok kalo mau cek harga. \n\nt. voc shopeefood sopifut voc goride voucher\n\n#zonauang #zonaba #zonajubel https://t.co/dffqjv14qt'
299,299,299,2021-10-21 13:31:37+00:00,"b""'laper'\n\n*scroll shopeefood* \n\ndan akhirnya order kopi"""
300,300,300,2021-10-21 13:29:30+00:00,b'@littlegutboi shopeefood murah bgt huhu brsyukur'
301,301,301,2021-10-21 13:17:58+00:00,"b'dear @shopeeid @shopeecare , saya udah 3x dapat orderan shopeefood fiktif mengatas nama kan saya dan nomer tlp saya dan kirim ke alamat kantor saya dan rumah saya dengan jumlah nominal 361rb, 2,5jt, 1,5jt . saya dan driver merasa di rugikan. sdh tlp cs tp tdk ad solusi yg jelas.'"
302,302,302,2021-10-21 13:15:59+00:00,b'subway blm masuk di gofood or grabfood or shopeefood yaa ???'
303,303,303,2021-10-21 13:10:56+00:00,b'non-sensor nya di ig yah..... #shopeefood #nanonano https://t.co/2b86axovxr'
304,304,304,2021-10-21 13:06:39+00:00,b'@hwniekyu tempatku gd shopeefood:('
305,305,305,2021-10-21 13:05:07+00:00,b'@bubuphilei mau buat shopeefood adekk\xf0\x9f\x98\xad'
306,306,306,2021-10-21 13:01:54+00:00,b'knpa ongkir shopeefood mahal semua \xf0\x9f\xa5\xb2'
307,307,307,2021-10-21 12:37:20+00:00,b'kalo lg diem gini trus belom makan bawaannya pengen buka shopeefood trs order pak gembus (lagi) deh\xe2\x80\xa6 \xf0\x9f\xa5\xb2'
308,308,308,2021-10-21 12:36:23+00:00,"b'kalo dulu belanja soymilk, terus sayur, dressing, sama oat gitu sekali belanja bisa mayan mahal tapiiiiiii bisa buat lama..\nnah kalo gak diatur nih duit rekening cepeeet bgt ngalir ke shopeefood. semakin diskon semakin boros syetaaaaan kaya semua murah mau diembat\xf0\x9f\x98\xab'"
309,309,309,2021-10-21 12:33:52+00:00,b'-dips! kasih tau resto yg jual churros enak yang bisa dibeli lewat grab/gojek/shopeefood dong'
310,310,310,2021-10-21 12:20:38+00:00,"b'update shopee sebab nak try shopeefood, tapi tak ada pun..\nmungkin belum cover johor lagi..'"
311,311,311,2021-10-21 12:19:54+00:00,"b'gak perlu takut sama tanggal tua, soalnya besok promo #shopeepayday bakal balik lagi! \xf0\x9f\xa4\xa9\xf0\x9f\xa4\xa9\n\nada banyaaaak banget promo yang bisa kamu nikmatin kayak shopeepay serba rp10, flash sale rp1, sampai shopeefood diskon 75%.\n\ncek info lengkapnya di https://t.co/nbzr1mgbep.\n#shopeepay https://t.co/zqyrvqmgfl'"
312,312,312,2021-10-21 12:15:03+00:00,"b'surat trbuka nih buat @shopeeid . barusan aja tadi sore saya mesen shopeefood pake voucher yang lumayan gede dan aman aman aja, terus skarang tbtb akun saya di non aktifkan terus mau login dapet notif begini? penjelasan nya dong tolong, itu masih ada shopeepaynya di dalam https://t.co/2jnjnprjjm'"
313,313,313,2021-10-21 12:10:13+00:00,"b'shopeefood, kalau kedainya out of delivery distance, janganlah bagitau waktu checkout. dah spend 45 minit pilih makanan know know kenot deliver. sakit.'"
314,314,314,2021-10-21 12:07:24+00:00,b'duit abis di shopeefood ae ini mah'
315,315,315,2021-10-21 12:02:46+00:00,"b'shopeefood tuh ada fitur chatnya ga sih, kenapa drivernya sering banget masuk2 kos trs teriak2. heran.'"
316,316,316,2021-10-21 11:45:22+00:00,b'ketika mas mas shopeefood temen gue sendiri udah gitu temen akrab :) https://t.co/ayxzqnjqfh'
317,317,317,2021-10-21 11:25:45+00:00,"b'lumayan klo pesen shopeefood, untuk maksi skaligus maklam di kantor'"
318,318,318,2021-10-21 11:22:50+00:00,b'@shopeefood_id reminder nih min untuk sesekali berbagi \xf0\x9f\x96\x92'
319,319,319,2021-10-21 11:14:17+00:00,"b'kebiasaan pake shopeefood, eh td pake grab trs drivernya kebetulan krj di shopeefood juga trs nanya ""tumben pake grab mbak"" \xf0\x9f\x98\x82'"
320,320,320,2021-10-21 11:12:21+00:00,"b'aku yg sekarang top up shopeepay bukan buat belanja, tapi buat jajan shopeefood terus\xf0\x9f\x98\xad\xf0\x9f\x98\xad\nya allah, boros kali aku\xf0\x9f\x98\xad\xf0\x9f\x98\xad'"
321,321,321,2021-10-21 11:08:57+00:00,b'bapaknya lucu&lt;3 https://t.co/ydlvztc1ly'
322,322,322,2021-10-21 11:07:36+00:00,b'pesen makan pake shopeefood aja aku masih split bill.'
323,323,323,2021-10-21 11:07:34+00:00,"b'tolong yaa @shopeefood_id @shopeeid lebih di perhatikan lagi sikap drivernya, saya gak pernah kecewa soal pesanan lain. tp bener2 kesel sama pelayanan shopee food nya.'"
324,324,324,2021-10-21 11:07:23+00:00,"b'guis yuk diorder cemilannya\xe2\x98\xba\xef\xb8\x8f\nmenu+price list lainnya ada di bawah ya\xf0\x9f\xa4\x97\n\nyang mau order langsung dm ke @cemilan_kenyang\ntersedia di gofood/grabfood/shopeefood\ncek instagram \xe2\x80\x9cmacronis_food\xe2\x80\x9d \n\ndom malang, jatim. https://t.co/ouhebfouce'"
325,325,325,2021-10-21 11:05:55+00:00,"b'saya pesen via @shopeefood_id @shopeeid karena emg lg ada promo, eh tp sikap drivernya kurang mengenakan bgt. \ndibanding driver @grabid atau @gojekindonesia, drivernya @shopeefood_id @shopeeid buruk bgt sumpah. \nemg cuma 1 driver ini aja tp sumpah bikin kesel.'"
326,326,326,2021-10-21 11:05:04+00:00,"b""promo wendy's paket spesial khusus gofood/shopeefood mulai rp. 69.999\n\nklik link di bawah ini untuk info selengkapnya\nhttps://t.co/011f4taqxu\n\n#wendys #promo #diskon #infopromo https://t.co/dzd0yp7imz"""
327,327,327,2021-10-21 11:03:44+00:00,"b'saya sampe di chat di tlpn dimarah-marahin sama driver @shopeefood_id @shopeeid grgr saya ngasig rate gak sesuai yg dia mau, pdhl sayapun gak ngasih rate rendah 3-1 tp 4 dan masih saya kasih tips meskipun saya kesel. hanya ngasih penilaian aja klo emang sikapnya gak sopan.'"
328,328,328,2021-10-21 11:01:36+00:00,"b'drivernya nyolot nyuruh saya liat titik antar. \nperasaan waktu terakhir saya pesen di @shopeefood_id @shopeeid dan saya ngasih tau titik antar drivernya ramah dan ngerti saya jelasin alamat, malah driver blg klo maps antar di shopee emang suka salah.'"
329,329,329,2021-10-21 10:59:38+00:00,"b'sumpah gak ngerti sama salah satu driver @shopeefood_id @shopeeid \nsaya ngasih tau baik2 klo alamat udh sesuai sama tempat saya tinggal, sebelumnya driver tersebut nanya titik antar apa betul saya blg itu alamatnya udh sesuai tp titik salah. \ndan saya ngasih tau baik2 tp.. (cont'"
330,330,330,2021-10-21 10:52:17+00:00,"b'@klniin asli serem banget hujannya, mana lagi pesen shopeefood kasiang mangnya'"
331,331,331,2021-10-21 10:38:43+00:00,"b'bantu viralkan !!! kelakuan yang mengaku driver shopeefood!!\nbukan saya lebay atau gimana, apakah pantas seorang yg berprofesi sebagai driver shopeefood dan gojek berkata seperti ini ??\nnorak , bantu viralkan !! lokasi depok https://t.co/5dci8ack3n'"
332,332,332,2021-10-21 10:35:28+00:00,b'makasih shopeefood https://t.co/wuqc91vks5'
333,333,333,2021-10-21 10:31:48+00:00,b'shopeefood knp bikin aku jajan trs\xf0\x9f\x98\xad\xf0\x9f\x98\xad'
334,334,334,2021-10-21 10:29:48+00:00,"b'guis hujan gini enaknya order pangsit goreng spesial yukk \xf0\x9f\x98\x8d\n\nyang mau order langsung dm ke @cemilan_kenyang\ntersedia di gofood/grabfood/shopeefood\ncek instagram \xe2\x80\x9cmacronis_food\xe2\x80\x9d \n\ndom malang, jatim. https://t.co/x4bvksersb'"
335,335,335,2021-10-21 10:27:43+00:00,b'ke circle k jalan kaki cuma 5 mnt tp ak pesen lewat shopeefood gpp kan ya\xf0\x9f\x98\x9e'
336,336,336,2021-10-21 10:23:24+00:00,"b'nasi goreng tiga de nok - palmerah sekarang ada di shopeefood! pesan sekarang, langsung diantar. https://t.co/wnlvfcwvng https://t.co/yunwnohlay'"
337,337,337,2021-10-21 10:22:48+00:00,b'@balebengong #kamisbisnis\nmasih ada nih diskon di shopeefood. nugget 35rb jadi 16rb saja.. jangan lupa claim voucher yaa..\nsilakan klik link nya https://t.co/qzot3anrj3 https://t.co/mbfsitd1ef'
338,338,338,2021-10-21 10:09:19+00:00,b'kenapa deh shopeefood makanannya ga ada decs jadi gua bingung isinya apa aja'
339,339,339,2021-10-21 10:08:55+00:00,"b'guis yuk diorder cemilannya\xe2\x98\xba\xef\xb8\x8f\nmenu+price list lainnya ada di bawah ya\xf0\x9f\xa4\x97\n\nyang mau order langsung dm ke @cemilan_kenyang\ntersedia di gofood/grabfood/shopeefood\ncek instagram \xe2\x80\x9cmacronis_food\xe2\x80\x9d \n\ndom malang, jatim. https://t.co/7kww9pct4h'"
